<?xml version="1.0" encoding="UTF-8"?>
<!DOCTYPE service-eca PUBLIC "-//OFBiz//DTD Service ECA Config//EN" "http://www.ofbiz.org/dtds/service-eca.dtd">

<service-eca>
    <eca service="testScv" event="commit">
        <condition field-name="message" operator="equals" value="12345"/>
        <action service="testBsh" mode="sync"/>
    </eca>
    <eca service="testCommit" event="global-commit">
        <action service="testScv" mode="sync"/>
    </eca>
    <eca service="testRollback" event="global-rollback">
        <action service="testScv" mode="sync"/>
    </eca>
</service-eca>
